name,ring,quadrant,isNew,description,Descriptive text here,Tech Champ,URL,URL Text,,ring_dropdown,,quadrant_dropdown,isNew_dropdown,Link to Radar,
Azure DevOps Boards,trial,tools,TRUE,"<strong>Azure DevOps Boards</strong> is an interface or a service of DevOps through which teams can manage their projects throughout the entire development lifecycle.<a href=""https://docs.microsoft.com/en-us/azure/devops/boards/get-started/what-is-azure-boards?view=azure-devops"">DevOps Boards</a> Tech Champ <strong>Karen</strong>.",is an interface or a service of DevOps through which teams can manage their projects throughout the entire development lifecycle.,Karen,https://docs.microsoft.com/en-us/azure/devops/boards/get-started/what-is-azure-boards?view=azure-devops,DevOps Boards,,,,,,,
Playwright,assess,tools,TRUE,"<strong>Playwright</strong> Playwright is a framework for Web Testing and Automation. It allows testing Chromium, Firefox and WebKit with a single API<a href=""https://playwright.dev/"">https://playwright.dev/</a> Tech Champ <strong>?</strong>.","Playwright is a framework for Web Testing and Automation. It allows testing Chromium, Firefox and WebKit with a single API",,https://playwright.dev/,https://playwright.dev/,,,,,,,
Power Automate,assess,tools,TRUE,"<strong>Power Automate</strong> formerly Microsoft Flow, is an online tool within the Microsoft 365 applications and add-ins, used for the creation of automated workflows between apps and services to synchronize files, get notifications, and collect data.<a href=""https://powerautomate.microsoft.com/en-gb/"">https://powerautomate.microsoft.com/en-gb/</a> Tech Champ <strong>Simon</strong>.","formerly Microsoft Flow, is an online tool within the Microsoft 365 applications and add-ins, used for the creation of automated workflows between apps and services to synchronize files, get notifications, and collect data.",Simon,https://powerautomate.microsoft.com/en-gb/,https://powerautomate.microsoft.com/en-gb/,,,,,,,
Power Apps ,assess,tools,TRUE,"<strong>Power Apps </strong> allows you to build time-saving workflows into everything from individual tasks to large-scale systems with seamless integration using hundreds of prebuilt connectors.<a href=""https://powerapps.microsoft.com/en-gb/"">https://powerapps.microsoft.com/en-gb/</a> Tech Champ <strong>Simon</strong>.",allows you to build time-saving workflows into everything from individual tasks to large-scale systems with seamless integration using hundreds of prebuilt connectors.,Simon,https://powerapps.microsoft.com/en-gb/,https://powerapps.microsoft.com/en-gb/,,,,,,,
Purview,assess,tools,TRUE,"<strong>Purview</strong> is a unified data governance solution that helps you manage and govern your on-premises, multicloud, and software-as-a-service (SaaS) data. Easily create a holistic, up-to-date map of your data landscape with automated data discovery, sensitive data classification, and end-to-end data lineage. Enable data consumers to find valuable, trustworthy data.<a href=""""></a> Tech Champ <strong>?</strong>.","is a unified data governance solution that helps you manage and govern your on-premises, multicloud, and software-as-a-service (SaaS) data. Easily create a holistic, up-to-date map of your data landscape with automated data discovery, sensitive data classification, and end-to-end data lineage. Enable data consumers to find valuable, trustworthy data.",,,,,,,,,,
nService Bus,hold,tools,FALSE,"<strong>nService Bus</strong> is an implementation of a 'service bus' pattern for .NET. As a developer, it helps you create decoupled applications that are easier to maintain, extend, scale and test.<a href=""https://particular.net/nservicebus"">https://particular.net/nservicebus</a> Tech Champ <strong>?</strong>.","is an implementation of a 'service bus' pattern for .NET. As a developer, it helps you create decoupled applications that are easier to maintain, extend, scale and test.",,https://particular.net/nservicebus,https://particular.net/nservicebus,,,,,,,
Jira,hold,tools,FALSE,"<strong>Jira</strong> is a proprietary issue tracking product developed by Atlassian that allows bug tracking and agile project management.<a href=""https://www.atlassian.com/software/jira""></a> Tech Champ <strong>Kate</strong>.",is a proprietary issue tracking product developed by Atlassian that allows bug tracking and agile project management.,Kate,https://www.atlassian.com/software/jira,,,,,,,,
SpecFlow Runner,hold,tools,TRUE,"<strong>SpecFlow Runner</strong> is a powerful test runner for SpecFlow that further boosts your automation productivity. But it does not play well with .Net 6<a href=""https://specflow.org/tools/runner/"">https://specflow.org/tools/runner/</a> Tech Champ <strong>?</strong>.",is a powerful test runner for SpecFlow that further boosts your automation productivity. But it does not play well with .Net 6,,https://specflow.org/tools/runner/,https://specflow.org/tools/runner/,,,,,,,
Soap UI,hold,tools,FALSE,"<strong>Soap UI</strong> is an open-source web service testing application for service-oriented architectures and representational state transfers. Its functionality covers web service inspection, invoking, development, simulation and mocking, functional testing, load and compliance testing.<a href=""https://www.soapui.org/""></a> Tech Champ <strong>?</strong>.","is an open-source web service testing application for service-oriented architectures and representational state transfers. Its functionality covers web service inspection, invoking, development, simulation and mocking, functional testing, load and compliance testing.",,https://www.soapui.org/,,,,,,,,
