name,ring,quadrant,isNew,description,Descriptive text here,Tech Champ,URL,URL Text,,ring_dropdown,,quadrant_dropdown,isNew_dropdown,,Link to Radar
ELMAH,assess,tools,FALSE,"<strong>ELMAH</strong> (Error Logging Modules and Handlers) is an open-source debugging tool for ASP.NET web services. When added to a running web application on a machine, exceptions that are thrown trigger event handlers in the ELMAH tool. These event handlers can include logging to various database back-ends, logging which can be viewed from a web portal, and the sending of notification emails, tweets and RSS articles to advise administrators of the problem. ELMAH provides a pluggable implementation of error logging.<a href=""https://elmah.io/"">https://elmah.io/</a> Tech Champ <strong>?</strong>.","(Error Logging Modules and Handlers) is an open-source debugging tool for ASP.NET web services. When added to a running web application on a machine, exceptions that are thrown trigger event handlers in the ELMAH tool. These event handlers can include logging to various database back-ends, logging which can be viewed from a web portal, and the sending of notification emails, tweets and RSS articles to advise administrators of the problem. ELMAH provides a pluggable implementation of error logging.",,https://elmah.io/,https://elmah.io/,,,,,,,
Teraform,assess,platforms,TRUE,"<strong>Teraform</strong>  is a tool for building, changing, and versioning infrastructure safely and efficiently. Terraform can manage existing and popular service providers as well as custom in-house solutions. Configuration files describe to Terraform the components needed to run a single application or your entire datacenter.<a href=""https://www.terraform.io/"">https://www.terraform.io/</a> Tech Champ <strong>?</strong>."," is a tool for building, changing, and versioning infrastructure safely and efficiently. Terraform can manage existing and popular service providers as well as custom in-house solutions. Configuration files describe to Terraform the components needed to run a single application or your entire datacenter.",,https://www.terraform.io/,https://www.terraform.io/,,,,,,,
MVC,hold,languages & frameworks,FALSE,"<strong>MVC</strong> stands for Model, View and Controller. MVC separates application into three components - Model, View and Controller. Model: Model represents shape of the data and business logic. It maintains the data of the application. Model objects retrieve and store model state in a database.<a href=""https://en.wikipedia.org/wiki/Model%E2%80%93view%E2%80%93controller"">wikipedia</a> Tech Champ <strong>?</strong>.","stands for Model, View and Controller. MVC separates application into three components - Model, View and Controller. Model: Model represents shape of the data and business logic. It maintains the data of the application. Model objects retrieve and store model state in a database.",,https://en.wikipedia.org/wiki/Model%E2%80%93view%E2%80%93controller,wikipedia,,,,,,,
WebForms,hold,languages & frameworks,FALSE,"<strong>WebForms</strong> ASP.NET Web Forms is a part of the ASP.NET web application framework and is included with Visual Studio. It is one of the four programming models you can use to create ASP.NET web applications, the others are ASP.NET MVC, ASP.NET Web Pages, and ASP.NET Single Page Applications.<a href=""https://docs.microsoft.com/en-us/aspnet/web-forms/what-is-web-forms"">MS ASP.NET WebForms</a> Tech Champ <strong>?</strong>.","ASP.NET Web Forms is a part of the ASP.NET web application framework and is included with Visual Studio. It is one of the four programming models you can use to create ASP.NET web applications, the others are ASP.NET MVC, ASP.NET Web Pages, and ASP.NET Single Page Applications.",,https://docs.microsoft.com/en-us/aspnet/web-forms/what-is-web-forms,MS ASP.NET WebForms,,,,,,,
AJAX,hold,languages & frameworks,FALSE,"<strong>AJAX</strong>  Asynchronous JavaScript and XML. AJAX is a technique for creating fast and dynamic web pages. AJAX allows web pages to be updated asynchronously by exchanging small amounts of data with the server behind the scenes. This means that it is possible to update parts of a web page, without reloading the whole page.<a href=""https://www.xul.fr/en-xml-ajax.html"">Ajax tutorial</a> Tech Champ <strong>?</strong>."," Asynchronous JavaScript and XML. AJAX is a technique for creating fast and dynamic web pages. AJAX allows web pages to be updated asynchronously by exchanging small amounts of data with the server behind the scenes. This means that it is possible to update parts of a web page, without reloading the whole page.",,https://www.xul.fr/en-xml-ajax.html,Ajax tutorial,,,,,,,
SQL Server,hold,languages & frameworks,FALSE,"<strong>SQL Server</strong> is a relational database management system developed by Microsoft. As a database server, it is a software product with the primary function of storing and retrieving data as requested by other software applications—which may run either on the same computer or on another computer across a network.<a href=""https://www.microsoft.com/en-in/sql-server/sql-server-2019"">SQL Server 2019</a> Tech Champ <strong>?</strong>.","is a relational database management system developed by Microsoft. As a database server, it is a software product with the primary function of storing and retrieving data as requested by other software applications—which may run either on the same computer or on another computer across a network.",,https://www.microsoft.com/en-in/sql-server/sql-server-2019,SQL Server 2019,,,,,,,
ASP,hold,languages & frameworks,FALSE,"<strong>ASP</strong> is an HTML page that includes one or more scripts (small embedded programs) that are processed on a Microsoft Web server before the page is sent to the user.<a href=""https://www.w3schools.com/asp/"">https://www.w3schools.com/asp/</a> Tech Champ <strong>?</strong>.",is an HTML page that includes one or more scripts (small embedded programs) that are processed on a Microsoft Web server before the page is sent to the user.,,https://www.w3schools.com/asp/,https://www.w3schools.com/asp/,,,,,,,
