name,ring,quadrant,isNew,description,Descriptive text here,Tech Champ,URL,URL Text,,ring_dropdown,,quadrant_dropdown,isNew_dropdown,Link to Radar,
Docker (For QA),trial,platforms,FALSE,"<strong>Docker (For QA)</strong>  is a framework for software development that emphasizes teamwork, learning, accountability and iterative progress toward a well-defined goal.<a href=""https://www.docker.com/"">https://www.docker.com/</a> Tech Champ <strong>?</strong>.","is a set of platform as a service products that use OS-level virtualization to deliver software in packages called containers. Containers are isolated from one another and bundle their own software, libraries and configuration files; they can communicate with each other through well-defined channels.",,https://www.docker.com/,https://www.docker.com/,,,,,,,
Power BI,trial,platforms,FALSE,"<strong>Power BI</strong> is exactly a rule of “progressive advancement”. “Mobile first”, as the name suggests, means that we start the product design from the mobile end which has more restrictions, then expand its features to create a tablet or desktop version.<a href=""https://powerbi.microsoft.com/en-us/""></a> Tech Champ <strong>Simon</strong>.",is a business analytics service by Microsoft. It aims to provide interactive visualizations and business intelligence capabilities with an interface simple enough for end users to create their own reports and dashboards.,Simon,https://powerbi.microsoft.com/en-us/,,,,,,,,
HCI,trial,platforms,FALSE,"<strong>HCI</strong> converges compute, storage, and management resources to a single industry‐standard x86 server, forming a seamless, software‐ defined environment. HCI is simple to use and manage, does not require specialists, and is far more cost-effective and cost-predictable than many traditional solutions.<a href=""https://www.trustmarque.com/modern-datacentre/software-defined-datacentre/?gclid=Cj0KCQiAsvTxBRDkARIsAH4W_j_C75ARUuEZ6Us4D6vqEjGBCZzqWygPf4RxbTfP3WLiB6ht25Ka18EaAuIrEALw_wcB"">HCI</a> Tech Champ <strong>Ian</strong>.","converges compute, storage, and management resources to a single industry‐standard x86 server, forming a seamless, software‐ defined environment. HCI is simple to use and manage, does not require specialists, and is far more cost-effective and cost-predictable than many traditional solutions.",Ian,https://www.trustmarque.com/modern-datacentre/software-defined-datacentre/?gclid=Cj0KCQiAsvTxBRDkARIsAH4W_j_C75ARUuEZ6Us4D6vqEjGBCZzqWygPf4RxbTfP3WLiB6ht25Ka18EaAuIrEALw_wcB,HCI,,,,,,,
NXS,trial,platforms,TRUE,"<strong>NXS</strong> is a network virtualization and security platform that enables the virtual cloud network, a software-defined approach to networking that extends across data centers, clouds and application frameworks.<a href=""https://www.vmware.com/uk/products/nsx.html#:~:text=Frequently%20Asked%20Questions-,What%20is%20VMware%20NSX%3F,centers%2C%20clouds%20and%20application%20frameworks."">VMWare.com</a> Tech Champ <strong>Ian</strong>.","is a network virtualization and security platform that enables the virtual cloud network, a software-defined approach to networking that extends across data centers, clouds and application frameworks.",Ian,"https://www.vmware.com/uk/products/nsx.html#:~:text=Frequently%20Asked%20Questions-,What%20is%20VMware%20NSX%3F,centers%2C%20clouds%20and%20application%20frameworks.",VMWare.com,,,,,,,
Azure Cognitive Services,trial,platforms,TRUE,"<strong>Azure Cognitive Services</strong> are cloud-based artificial intelligence (AI) services that help you build cognitive intelligence into your applications. They are available as REST APIs, client library SDKs, and user interfaces. You can add cognitive features to your applications without having AI or data science skills<a href=""https://azure.microsoft.com/en-gb/services/cognitive-services/"">https://azure.microsoft.com/en-gb/services/cognitive-services/</a> Tech Champ <strong>?</strong>.","are cloud-based artificial intelligence (AI) services that help you build cognitive intelligence into your applications. They are available as REST APIs, client library SDKs, and user interfaces. You can add cognitive features to your applications without having AI or data science skills",,https://azure.microsoft.com/en-gb/services/cognitive-services/,https://azure.microsoft.com/en-gb/services/cognitive-services/,,,,,,,
SOLID,adopt,techniques,FALSE,"<strong>SOLID</strong> The five principles are as follows:

S – Single Responsibility Principle (SRP)
O – Open Closed Principle (OCP)
L – Liskov Substitution Principle (LSP)
I – Interface Segregation Principle (ISP)
D – Dependency Inversion Principle (DIP)<a href=""https://itnext.io/solid-principles-explanation-and-examples-715b975dcad4"">SOLID Design Principles</a> Tech Champ <strong>?</strong>.","The five principles are as follows:

S – Single Responsibility Principle (SRP)
O – Open Closed Principle (OCP)
L – Liskov Substitution Principle (LSP)
I – Interface Segregation Principle (ISP)
D – Dependency Inversion Principle (DIP)",,https://itnext.io/solid-principles-explanation-and-examples-715b975dcad4,SOLID Design Principles,,,,,,,
Message Queues,adopt,techniques,FALSE,"<strong>Message Queues</strong> provide an asynchronous communications protocol, meaning that the sender and receiver of the message do not need to interact with the message queue at the same time. Messages placed onto the queue are stored until the recipient retrieves them.<a href=""https://www.cloudamqp.com/blog/2014-12-03-what-is-message-queuing.html"">what is message queuing</a> Tech Champ <strong>?</strong>.","provide an asynchronous communications protocol, meaning that the sender and receiver of the message do not need to interact with the message queue at the same time. Messages placed onto the queue are stored until the recipient retrieves them.",,https://www.cloudamqp.com/blog/2014-12-03-what-is-message-queuing.html,what is message queuing,,,,,,,
BDD,adopt,techniques,FALSE,"<strong>BDD</strong> In software engineering, behavior-driven development is an Agile software development process that encourages collaboration between developers, QA and non-technical or business participants in a software project.<a href=""https://cucumber.io/docs/bdd/overview/"">https://cucumber.io/docs/bdd/overview/</a> Tech Champ <strong>?</strong>.","In software engineering, behavior-driven development is an Agile software development process that encourages collaboration between developers, QA and non-technical or business participants in a software project.",,https://cucumber.io/docs/bdd/overview/,https://cucumber.io/docs/bdd/overview/,,,,,,,
Stories (INVEST),adopt,techniques,FALSE,"<strong>Stories (INVEST)</strong> In order to create good user stories, start by remembering to INVEST in good user stories.  INVEST is an acronym which encompasses the following concepts which make up a good user story:  Independent Negotiable Valuable Estimable Small Testable. <a href=""https://youtu.be/INbNIQWL3sY"">agile for all</a> Tech Champ <strong>?</strong>.","In order to create good user stories, start by remembering to INVEST in good user stories.  INVEST is an acronym which encompasses the following concepts which make up a good user story:  Independent Negotiable Valuable Estimable Small Testable. ",,https://youtu.be/INbNIQWL3sY,agile for all,,,,,,,
TDD,adopt,techniques,FALSE,"<strong>TDD</strong> Test-driven development (TDD) is a development technique where you must first write a test that fails before you write new functional code. TDD is being quickly adopted by agile software developers for development of application source code<a href=""https://youtu.be/qkblc5WRn-U"">Uncle Bob does TDD</a> Tech Champ <strong>?</strong>.",Test-driven development (TDD) is a development technique where you must first write a test that fails before you write new functional code. TDD is being quickly adopted by agile software developers for development of application source code,,https://youtu.be/qkblc5WRn-U,Uncle Bob does TDD,,,,,,,
API First,adopt,techniques,FALSE,"<strong>API First</strong> development is a strategy in which the first order of business is to develop an API that puts your target developer's interests first and then build the product on top of it (be it a website, mobile application, or a SaaS software).<a href=""https://dzone.com/articles/an-api-first-development-approach-1""></a> Tech Champ <strong>?</strong>.","development is a strategy in which the first order of business is to develop an API that puts your target developer's interests first and then build the product on top of it (be it a website, mobile application, or a SaaS software).",,https://dzone.com/articles/an-api-first-development-approach-1,,,,,,,,
Scrum,adopt,techniques,FALSE,"<strong>Scrum</strong>  is a framework for software development that emphasizes teamwork, learning, accountability and iterative progress toward a well-defined goal.<a href=""http://scrumtrainingseries.com/"">http://scrumtrainingseries.com/</a> Tech Champ <strong>?</strong>."," is a framework for software development that emphasizes teamwork, learning, accountability and iterative progress toward a well-defined goal.",,http://scrumtrainingseries.com/,http://scrumtrainingseries.com/,,,,,,,
Pair Programming,adopt,techniques,FALSE,"<strong>Pair Programming</strong>  is an agile software development technique in which two programmers work together at one workstation. One, the driver, writes code while the other, the observer or navigator, reviews each line of code as it is typed in. The two programmers switch roles frequently.<a href=""https://youtu.be/vgkahOzFH2Q"">Pairing </a> Tech Champ <strong>?</strong>."," is an agile software development technique in which two programmers work together at one workstation. One, the driver, writes code while the other, the observer or navigator, reviews each line of code as it is typed in. The two programmers switch roles frequently.",,https://youtu.be/vgkahOzFH2Q,Pairing ,,,,,,,
C4 Architecture model,adopt,techniques,FALSE,"<strong>C4 Architecture model</strong> model is an ""abstraction-first"" approach to diagramming software architecture, based upon abstractions that reflect how software architects and developers think about and build software. The small set of abstractions and diagram types makes the C4 model easy to learn and use.<a href=""https://c4model.com/"">https://c4model.com/</a> Tech Champ <strong>?</strong>.","model is an ""abstraction-first"" approach to diagramming software architecture, based upon abstractions that reflect how software architects and developers think about and build software. The small set of abstractions and diagram types makes the C4 model easy to learn and use.",,https://c4model.com/,https://c4model.com/,,,,,,,
Micro services,adopt,techniques,FALSE,"<strong>Micro services</strong> are a software development technique—a variant of the service-oriented architecture (SOA) architectural style that structures an application as a collection of loosely coupled services. In a microservices architecture, services are fine-grained and the protocols are lightweight.<a href=""https://youtu.be/2yko4TbC8cI"">Martin Fowler talks about micro services</a> Tech Champ <strong>?</strong>.","are a software development technique—a variant of the service-oriented architecture (SOA) architectural style that structures an application as a collection of loosely coupled services. In a microservices architecture, services are fine-grained and the protocols are lightweight.",,https://youtu.be/2yko4TbC8cI,Martin Fowler talks about micro services,,,,,,,
Planning Poker,adopt,techniques,FALSE,"<strong>Planning Poker</strong>  is a consensus-based estimating technique. Agile teams around the world use Planning Poker to estimate their product backlogs. Planning Poker can be used with story points, ideal days, or any other estimating unit.<a href=""https://www.mountaingoatsoftware.com/agile/planning-poker""></a> Tech Champ <strong>?</strong>."," is a consensus-based estimating technique. Agile teams around the world use Planning Poker to estimate their product backlogs. Planning Poker can be used with story points, ideal days, or any other estimating unit.",,https://www.mountaingoatsoftware.com/agile/planning-poker,,,,,,,,
MobileFirst,adopt,techniques,FALSE,"<strong>MobileFirst</strong> is exactly a rule of “progressive advancement”. “Mobile first”, as the name suggests, means that we start the product design from the mobile end which has more restrictions, then expand its features to create a tablet or desktop version.<a href=""https://medium.com/@Vincentxia77/what-is-mobile-first-design-why-its-important-how-to-make-it-7d3cf2e29d00"">WhatIsMobileFirst</a> Tech Champ <strong>Alison</strong>.","is exactly a rule of “progressive advancement”. “Mobile first”, as the name suggests, means that we start the product design from the mobile end which has more restrictions, then expand its features to create a tablet or desktop version.",Alison,https://medium.com/@Vincentxia77/what-is-mobile-first-design-why-its-important-how-to-make-it-7d3cf2e29d00,WhatIsMobileFirst,,,,,,,
3 Amigos,adopt,techniques,FALSE,"<strong>3 Amigos</strong> normally consisting of BA, Developer, and Tester - is one of the key ways to change the culture of the team to be more Agile, and encourage more collaboration. ... The Three Amigos ensures a common understanding for a story in the team; a session between Product Owner (Business), Developer, Tester<a href=""https://www.youtube.com/watch?v=DZHbUVmtRTE"">Three Amigos</a> Tech Champ <strong>Karen</strong>.","normally consisting of BA, Developer, and Tester - is one of the key ways to change the culture of the team to be more Agile, and encourage more collaboration. ... The Three Amigos ensures a common understanding for a story in the team; a session between Product Owner (Business), Developer, Tester",Karen,https://www.youtube.com/watch?v=DZHbUVmtRTE,Three Amigos,,,,,,,
ScrumBan,trial,techniques,TRUE,"<strong>ScrumBan</strong> <a href=""https://kanbanize.com/kanban-resources/getting-started/what-is-kanban/"">WhatIsKanban</a> Tech Champ <strong>Michael</strong>.",,Michael,https://kanbanize.com/kanban-resources/getting-started/what-is-kanban/,WhatIsKanban,,,,,,,
Specflow,adopt,tools,FALSE,"<strong>Specflow</strong> is the open source port of Cucumber for .NET. Define automatic tests in Gherkin and execute them using MSTest, NUnit, xUnit and MbUnit.<a href=""https://specflow.org/"">https://specflow.org/</a> Tech Champ <strong>?</strong>.","is the open source port of Cucumber for .NET. Define automatic tests in Gherkin and execute them using MSTest, NUnit, xUnit and MbUnit.",,https://specflow.org/,https://specflow.org/,,,,,,,
selenium,adopt,tools,FALSE,"<strong>selenium</strong> Selenium automates browsers. That's it! What you do with that power is entirely up to you. Primarily, it is for automating web applications for testing purposes, but is certainly not limited to just that.<a href=""https://www.seleniumhq.org/"">https://www.seleniumhq.org/</a> Tech Champ <strong>?</strong>.","Selenium automates browsers. That's it! What you do with that power is entirely up to you. Primarily, it is for automating web applications for testing purposes, but is certainly not limited to just that.",,https://www.seleniumhq.org/,https://www.seleniumhq.org/,,,,,,,
RestSharp,adopt,tools,FALSE,"<strong>RestSharp</strong> is a comprehensive, open-source HTTP client library that works with all kinds of DotNet technologies. It can be used to build robust applications by making it easy to interface with public APIs and quickly access data without the complexity of dealing with raw HTTP requests.<a href=""https://restsharp.dev/"">https://restsharp.dev/</a> Tech Champ <strong>?</strong>.","is a comprehensive, open-source HTTP client library that works with all kinds of DotNet technologies. It can be used to build robust applications by making it easy to interface with public APIs and quickly access data without the complexity of dealing with raw HTTP requests.",,https://restsharp.dev/,https://restsharp.dev/,,,,,,,
Log Analytics,adopt,tools,TRUE,"<strong>Log Analytics</strong> Log Analytics is a tool in the Azure portal to edit and run log queries from data collected by Azure Monitor Logs and interactively analyze their results. You can use Log Analytics queries to retrieve records that match particular criteria, identify trends, analyze patterns, and provide various insights into your data.<a href=""https://docs.microsoft.com/en-us/azure/azure-monitor/logs/log-analytics-tutorial"">log-analytics-tutorial</a> Tech Champ <strong>?</strong>.","Log Analytics is a tool in the Azure portal to edit and run log queries from data collected by Azure Monitor Logs and interactively analyze their results. You can use Log Analytics queries to retrieve records that match particular criteria, identify trends, analyze patterns, and provide various insights into your data.",,https://docs.microsoft.com/en-us/azure/azure-monitor/logs/log-analytics-tutorial,log-analytics-tutorial,,,,,,,
ZEPLIN,adopt,tools,FALSE,"<strong>ZEPLIN</strong> is a collaboration tool, built for UI designers and frontend developers. WithZeplin, collaboration between designers and developers becomes easy, effective and saves time. Designers can turn their designs into specs and guidelines, and developers can generate platform-related code snippets<a href=""https://zeplin.io/"">https://zeplin.io/</a> Tech Champ <strong>Alison</strong>.","is a collaboration tool, built for UI designers and frontend developers. WithZeplin, collaboration between designers and developers becomes easy, effective and saves time. Designers can turn their designs into specs and guidelines, and developers can generate platform-related code snippets",Alison,https://zeplin.io/,https://zeplin.io/,,,,,,,
IronPDF,adopt,tools,FALSE,"<strong>IronPDF</strong> is a commercial Grade PDF Generation library for the . Net platform, written in C#.<a href=""https://ironpdf.com/"">https://ironpdf.com/</a> Tech Champ <strong>?</strong>.","is a commercial Grade PDF Generation library for the . Net platform, written in C#.",,https://ironpdf.com/,https://ironpdf.com/,,,,,,,
Postman,adopt,tools,FALSE,"<strong>Postman</strong> is a Google Chrome app for interacting with HTTP APIs. It presents you with a friendly GUI for constructing requests and reading responses. The people behind Postman also offer an add-on package called Jetpacks, which includes some automation tools and, most crucially, a Javascript testing library<a href=""https://www.youtube.com/watch?v=t5n07Ybz7yI"">The Basics of Using Postman</a> Tech Champ <strong>?</strong>.","is a Google Chrome app for interacting with HTTP APIs. It presents you with a friendly GUI for constructing requests and reading responses. The people behind Postman also offer an add-on package called Jetpacks, which includes some automation tools and, most crucially, a Javascript testing library",,https://www.youtube.com/watch?v=t5n07Ybz7yI,The Basics of Using Postman,,,,,,,
Insomnia,adopt,tools,FALSE,"<strong>Insomnia</strong> is a free cross-platform desktop application that takes the pain out of interacting with and designing HTTP-based APIs. Insomnia combines an easy-to-use interface with advanced functionality like authentication helpers, code generation, and environment variables.<a href=""https://insomnia.rest/"">https://insomnia.rest/</a> Tech Champ <strong>Harry</strong>.","is a free cross-platform desktop application that takes the pain out of interacting with and designing HTTP-based APIs. Insomnia combines an easy-to-use interface with advanced functionality like authentication helpers, code generation, and environment variables.",Harry,https://insomnia.rest/,https://insomnia.rest/,,,,,,,
Browser Stack,adopt,tools,FALSE,"<strong>Browser Stack</strong> is a cloud web and mobile testing platform that enables developers to test their websites and mobile applications across on-demand browsers, operating systems and real mobile devices, without requiring users to install or maintain an internal lab of virtual machines, devices or emulators.<a href=""https://www.browserstack.com/""></a> Tech Champ <strong>?</strong>.","is a cloud web and mobile testing platform that enables developers to test their websites and mobile applications across on-demand browsers, operating systems and real mobile devices, without requiring users to install or maintain an internal lab of virtual machines, devices or emulators.",,https://www.browserstack.com/,,,,,,,,
GIT,adopt,tools,FALSE,"<strong>GIT</strong> is a distributed version-control system for tracking changes in source code during software development. It is designed for coordinating work among programmers, but it can be used to track changes in any set of files. Its goals include speed, data integrity, and support for distributed, non-linear workflows.<a href=""https://git-scm.com/""></a> Tech Champ <strong>?</strong>.","is a distributed version-control system for tracking changes in source code during software development. It is designed for coordinating work among programmers, but it can be used to track changes in any set of files. Its goals include speed, data integrity, and support for distributed, non-linear workflows.",,https://git-scm.com/,,,,,,,,
PostCSS,adopt,tools,FALSE,"<strong>PostCSS</strong> A tool for transforming CSS with JavaScript<a href=""https://postcss.org/"">https://postcss.org/</a> Tech Champ <strong>?</strong>.",A tool for transforming CSS with JavaScript,,https://postcss.org/,https://postcss.org/,,,,,,,
Sass,adopt,tools,FALSE,"<strong>Sass</strong> Syntactically Awesome Style Sheets, mature, stable, and powerful professional grade CSS extension language<a href=""https://sass-lang.com/"">https://sass-lang.com/</a> Tech Champ <strong>?</strong>.","Syntactically Awesome Style Sheets, mature, stable, and powerful professional grade CSS extension language",,https://sass-lang.com/,https://sass-lang.com/,,,,,,,
Google Analytics,adopt,tools,FALSE,"<strong>Google Analytics</strong> User Journey visulisation<a href=""""></a> Tech Champ <strong>Simon</strong>.",User Journey visulisation,Simon,,,,,,,,,
Intergration Services,adopt,tools,FALSE,"<strong>Intergration Services</strong> ISAC<a href=""""></a> Tech Champ <strong>Simon</strong>.",ISAC,Simon,,,,,,,,,
SonarCloud,adopt,tools,FALSE,"<strong>SonarCloud</strong> is a cloud service offered by SonarSource and based on SonarQube. SonarQube is a widely adopted open source platform to inspect continuously the quality of source code and detect bugs, vulnerabilities and code smells in more than 20 different languages<a href=""https://sonarcloud.io/""></a> Tech Champ <strong>?</strong>.","is a cloud service offered by SonarSource and based on SonarQube. SonarQube is a widely adopted open source platform to inspect continuously the quality of source code and detect bugs, vulnerabilities and code smells in more than 20 different languages",,https://sonarcloud.io/,,,,,,,,
Adobe XD,adopt,tools,TRUE,"<strong>Adobe XD</strong> is a vector-based user experience design tool for web apps and mobile apps, developed and published by Adobe Inc. It is available for macOS and Windows, although there are versions for iOS and Android to help preview the result of work directly on mobile devices.<a href=""https://www.adobe.com/uk/products/xd/details.html"">Adobe XD</a> Tech Champ <strong>Alison</strong>.","is a vector-based user experience design tool for web apps and mobile apps, developed and published by Adobe Inc. It is available for macOS and Windows, although there are versions for iOS and Android to help preview the result of work directly on mobile devices.",Alison,https://www.adobe.com/uk/products/xd/details.html,Adobe XD,,,,,,,
miro,adopt,tools,FALSE,"<strong>miro</strong> is the online collaborative whiteboarding platform that enables distributed teams to work effectively together, from brainstorming with digital sticky notes to planning and managing agile workflows<a href=""miro.com"">miro.com</a> Tech Champ <strong>Michael L</strong>.","is the online collaborative whiteboarding platform that enables distributed teams to work effectively together, from brainstorming with digital sticky notes to planning and managing agile workflows",Michael L,miro.com,miro.com,,,,,,,
Nlog,adopt,tools,FALSE,"<strong>Nlog</strong> is a flexible and free logging platform for various .NET platforms, including .NET standard. NLog makes it easy to write to several targets. (database, file, console) and change the logging configuration on-the-fly. NLog has support for structured and traditional logging.<a href=""""></a> Tech Champ <strong>?</strong>.","is a flexible and free logging platform for various .NET platforms, including .NET standard. NLog makes it easy to write to several targets. (database, file, console) and change the logging configuration on-the-fly. NLog has support for structured and traditional logging.",,,,,,,,,,
HotJar,trial,tools,TRUE,"<strong>HotJar</strong> is a powerful tool that reveals the online behavior and voice of your users. By combining both Analysis and Feedback tools, Hotjar gives you the 'big picture' of how to improve your site's user experience and performance/conversion rates.<a href=""https://www.hotjar.com/"">https://www.hotjar.com/</a> Tech Champ <strong>Alison</strong>.","is a powerful tool that reveals the online behavior and voice of your users. By combining both Analysis and Feedback tools, Hotjar gives you the 'big picture' of how to improve your site's user experience and performance/conversion rates.",Alison,https://www.hotjar.com/,https://www.hotjar.com/,,,,,,,
